{"$id":"https://justinahiggins614-cmyk.github.io/signature-chip-maker/schema/manifest.schema.json","$schema":"https://json-schema.org/draft/2020-12/schema","$title":"JAH Chip Archive Manifest","description":"Authoritative archive manifest: the single source of truth for archive counts. Homepage, Finder, archive pages, API, and sitemap all read it. Historical copies are immutable.","properties":{"archive_version":{"description":"Manifest format date, e.g. '2026-10-03'.","type":"string"},"archived_designs":{"type":"integer"},"catalog_feed":{"type":"string"},"chunks":{"properties":{"count":{"type":"integer"},"pattern":{"type":"string"},"per_chunk":{"type":"integer"}},"required":["count","pattern","per_chunk"],"type":"object"},"completeness_status_vocabulary":{"items":{"type":"string"},"type":"array"},"creation_mode":{"description":"Creation mode of all seeded designs.","type":"string"},"creation_modes":{"items":{"type":"string"},"type":"array"},"deep_link":{"type":"string"},"design_status":{"properties":{"current":{"type":"string"},"definition":{"type":"string"},"mfg_status":{"type":"string"},"sim_status":{"type":"string"},"test_status":{"type":"string"}},"required":["current","definition","sim_status","test_status","mfg_status"],"type":"object"},"earliest_id":{"pattern":"^JAH-CHIP-\\d{6}$","type":"string"},"engine_version":{"description":"ChipEngine generator version.","type":"string"},"families":{"items":{"properties":{"count":{"minimum":0,"type":"integer"},"key":{"description":"Family code: CPU, GPU, NPU, SOC, MCU, FPGA, MEMC, SENSOR, PMIC, QCTRL, PHOT, NEURO, DSP, MODEM, SEC, CHIPLET.","type":"string"},"label":{"type":"string"}},"required":["key","label","count"],"type":"object"},"type":"array"},"family_count":{"type":"integer"},"generated_designs":{"type":"integer"},"generator_version":{"description":"Generator script version that seeded the archive.","type":"string"},"goal":{"description":"March target: 1,000,000 designs.","type":"integer"},"hashes_index":{"description":"Per-design SHA-256 content hash index.","type":"string"},"id_scheme":{"type":"string"},"index_hash_sha256":{"description":"SHA-256 of data/index/chips.search.json.gz as published.","pattern":"^[0-9a-f]{64}$","type":"string"},"index_version":{"type":"string"},"latest_id":{"pattern":"^JAH-CHIP-\\d{6}$","type":"string"},"manifest_id":{"type":"string"},"note":{"type":"string"},"progress":{"type":"string"},"record_status":{"type":"string"},"remaining_to_goal":{"minimum":0,"type":"integer"},"schema_version":{"description":"Chip Record Standard version.","type":"string"},"search_index":{"type":"string"},"site":{"type":"string"},"site_number":{"type":"integer"},"site_url":{"type":"string"},"sitemap_index":{"type":"string"},"static_catalog":{"type":"string"},"total_designs":{"minimum":0,"type":"integer"},"updated":{"description":"Manifest generation timestamp (UTC, ISO).","type":"string"},"value_kind":{"type":"string"},"value_kind_note":{"type":"string"}},"required":["site","site_number","updated","archive_version","total_designs","generated_designs","archived_designs","goal","remaining_to_goal","earliest_id","latest_id","families","family_count","index_hash_sha256","generator_version","engine_version","schema_version","index_version","design_status","completeness_status_vocabulary","creation_modes","value_kind"],"type":"object"}